<!DOCTYPE verb SYSTEM "verb.dtd">
<verb>
    <id>mitoSAn-j</id>
    <comment/>
    <frameset cdef="" edef="protected, preserved" id="01">
        <role argnum="1" argrole="protected thing"/>
        <frame>
            <mapping>
                <comment/>
            </mapping>
            <example>
                <parse>طب و عربيتى متصانة و بتاع ؟</parse>
                <comment/>
                <arg f="" g="my car" n="0">عربيتى</arg>
            </example>
            <comment/>
        </frame>
        <comment/>
        <role argnum="2" argrole="from what?"/>
    </frameset>
</verb>
