<!DOCTYPE verb SYSTEM "verb.dtd">
<verb>
<id>makotuwb</id>
<frameset cdef="" edef="written" id="01" vncls="">
<role argnum="1" argrole="written thing" vncls="" vntheta=""/>
<role argnum="2" argrole="location" vncls="" vntheta=""/>
<frame>
<example>
<parse>(VP
    (PRT
      (NEG_PART لن))
    (IV1P+IV+IVSUFF_MOOD:S نكون)
    (NP-SBJ
      (-NONE- *))
    (ADJP-PRD
      (ADJ_COMP+CASE_DEF_ACC اقل)
      (NP-ADV
        (NP
          (NOUN غيرة))
        (CONJ و)
        (NP
          (NP
            (NOUN+CASE_INDEF_ACC اندفاعا))
          (PP
            (PREP في)
            (NP
              (NOUN+CASE_DEF_GEN سبيل)
              (NP
                (NP
                  (NOUN+CASE_INDEF_GEN وطن))
                (SBAR
                  (SBAR
                    (WHNP-1
                      (-NONE- 0))
                    (S
                      (NP-SBJ
                        (NOUN+CASE_DEF_NOM عمر)
                        (NP
                          (NP
                            (POSS_PRON_3MS ه))
                          (NP
                            (-NONE- *T*-1))))
                      (NP-PRD
                        (NOUN+CASE_DEF_NOM عمر)
                        (NP
                          (DET+NOUN+CASE_DEF_GEN التاريخ)
                          (DET+ADJ+CASE_DEF_GEN المكتوب)))))</parse>
<arg f="" g="it" n="1">? &lt; التاريخ</arg>
<comment/>
</example>
<comment/>
</frame>
<comment/>
</frameset>
<comment/>
<frameset cdef="" edef="destined, fated" id="02" vncls="">
<role argnum="0" argrole="agent" vncls="" vntheta=""/>
<frame>
<mapping>
<comment/>
</mapping>
<example>
<parse>مكتوب علينا الفشل</parse>
<comment/>
<arg f="" g="on us" n="1">علينا</arg>
<arg f="" g="the failure" n="2">الفشل</arg>
</example>
<comment/>
</frame>
<comment/>
<role argnum="1" argrole="entity destined" vncls="" vntheta=""/>
<role argnum="2" argrole="to what" vncls="" vntheta=""/>
</frameset>
</verb>
