<!DOCTYPE verb SYSTEM "verb.dtd">
<verb>
<id>xabuv-i</id>
<comment/>
<frameset cdef="" edef="to be or become malicious or malevolnet" id="01">
<role argnum="1" argrole="entity getting malicious"/>
<frame>
<mapping>
<comment/>
</mapping>
<example>
<parse>خبث الرجل في سلوكه</parse>
<comment/>
<arg f="" g="the man" n="1">الرجل</arg>
<arg f="" g="in his behavior" n="2">في سلوكه</arg>
</example>
<comment/>
</frame>
<comment/>
<role argnum="2" argrole="in what"/>
</frameset>
</verb>
