<!DOCTYPE verb SYSTEM "verb.dtd">
<verb>
    <id>{inoEajaq</id>
    <comment/>
    <frameset cdef="" edef="to clamor" id="01">
        <role argnum="1" argrole="demander"/>
        <frame>
            <mapping>
                <comment/>
            </mapping>
            <example>
                <parse>انفض المؤتمر الذي انعجقت به بيروت</parse>
                <comment/>
                <arg f="" g="Beirut" n="0">بيروت</arg>
                <arg f="" g="with it" n="1">به</arg>
            </example>
            <comment/>
        </frame>
        <comment/>
        <role argnum="2" argrole="demanded"/>
    </frameset>
</verb>
