<!DOCTYPE verb SYSTEM "verb.dtd">
<verb>
    <id>OagoDab</id>
    <frameset cdef="" edef="to anger, upset" id="01">
        <role argnum="0" argrole="entity causing anger"/>
        <role argnum="1" argrole="angry entity"/>
        <frame>
            <example>
                <parse>
                    (S
                    (NP-SBJ
                    (DET+NOUN+CASE_DEF_NOM الأمر))
                    (SBAR-PRD
                    (WHNP-1
                    (REL_PRON الذي))
                    (S
                    (VP
                    (PV+PVSUFF_SUBJ:3MS اغضب)
                    (NP-SBJ
                    (-NONE- *T*-1))
                    (NP-OBJ
                    (NOUN والد)
                    (NP
                    (POSS_PRON_1S ي)))
                    (S-ADV
                    (VP
                    (ADJ.VN+CASE_INDEF_ACC قائلاً)
                    (NP-SBJ
                    (-NONE- *-1))
                    (PP
                    (PREP ل)
                    (NP
                    (PRON_3FS ها)))
                    (PUNC :)
                    (S
                    (PUNC &amp;quot;)
                    (S
                    (VP
                    (PRT
                    (NEG_PART لا))
                    (IV1S+IV+IVSUFF_MOOD:I ادري)
                    (NP-SBJ
                    (-NONE- *))
                    (SBAR-ADV
                    (WHADVP-4
                    (INTERROG_ADV لِمَ))
                    (S
                    (VP
                    (IV2FS+IV+IVSUFF_SUBJ:2FS_MOOD:I تصرّين)
                    (NP-SBJ
                    (-NONE- *))
                    (PP-CLR
                    (PREP على)
                    (S-NOM
                    (VP
                    (NOUN.VN+CASE_DEF_GEN ترك)
                    (NP-SBJ
                    (-NONE- *))
                    (NP-OBJ-3
                    (NP
                    (DEM_PRON_MS هذا))
                    (NP
                    (DET+NOUN+CASE_DEF_GEN الطفل)))
                    (S
                    (VP
                    (IV3MS+IV+IVSUFF_MOOD:I يشاهد)
                    (NP-SBJ
                    (-NONE- *-3))
                    (NP-OBJ
                    (NP
                    (DEM_PRON_F هذه))
                    (NP
                    (DET+NOUN+CASE_DEF_ACC الافلام))))))))
                    (ADVP-PRP
                    (-NONE- *T*-4)))))))
                    (PUNC ,)
                    (CONJ ف)
                    (S
                    (NP-TPC-2
                    (PRON_3MS هو))
                    (VP
                    (PRT
                    (NEG_PART لا))
                    (IV3MS+IV+IVSUFF_MOOD:I يضحك)
                    (NP-SBJ
                    (-NONE- *T*-2))))))))))
                    (PUNC -LRB-)
                    (PUNC .)
                    (PUNC .)
                    (PUNC .)
                    (PUNC -RRB-))
                </parse>
                <arg f="" g="" n="0">-NONE- *T*-1</arg>
                <arg f="" g="my father" n="1">والدي</arg>
                <arg f="mnr" g="as he said: &amp;quot;I don't know why you let this child watch these movies&amp;quot;" n="m">&amp;quot; لا ادري لِمَ تصرّين على ترك  هذا الطفل يشاهد 3 هذه الافلام</arg>
            </example>
        </frame>
    </frameset>
</verb>
