<!DOCTYPE verb SYSTEM "verb.dtd">
<verb>
    <id>kAbar</id>
    <frameset cdef="" edef="to stickle" id="01">
        <role argnum="0" argrole="insister"/>
        <role argnum="1" argrole="thing insisted"/>
        <frame>
            <example>
                <parse>
                    (S
                    (NP-TPC-1
                    (NOUN_QUANT+CASE_DEF_ACC بعض)
                    (NP
                    (DET+NOUN+NSUFF_FEM_SG+CASE_DEF_GEN الانظمة)))
                    (VP
                    (IV3FS+IV+IVSUFF_MOOD:I تفهم)
                    (NP-SBJ
                    (-NONE- *T*-1))
                    (NP-OBJ
                    (IVSUFF_DO:3FS ها))))
                    (CONJ و)
                    (S
                    (VP
                    (IV3FS+IV+IVSUFF_MOOD:I تكابر)
                    (NP-SBJ
                    (-NONE- *))
                    (NP-PRP
                    (NP
                    (NOUN+CASE_INDEF_ACC خوفا))
                    (PP
                    (PREP على)
                    (NP
                    (NP
                    (NOUN+CASE_DEF_GEN كراسي)
                    (NP
                    (POSS_PRON_3FS ها)))
                </parse>
                <arg f="" g="It" n="0">-NONE- *&amp;lt;بعض الانظمة</arg>
                <arg f="cau" g="pecause of Fearing  of ..." n="m">خوفا على كراسيها</arg>
            </example>
        </frame>
    </frameset>
</verb>
