<!DOCTYPE verb SYSTEM "verb.dtd">
<verb>
    <id>$araH-a</id>
    <frameset cdef="" edef="to explain" id="01">
        <role argnum="0" argrole="the explainer"/>
        <role argnum="1" argrole="the explanation"/>
        <role argnum="2" argrole="the recipient of the explanation"/>
        <frame>
            <example>
                <parse>
                    (S
                    (CONJ و)
                    (VP
                    (PRT
                    (FUT_PART س)
                    (IV3MS+IV+IVSUFF_MOOD:I يظهر)
                    (NP-SBJ
                    (NOUN_PROP بوش)
                    (NP-OBJ
                    (NP
                    (NOUN+CASE_INDEF_ACC تفهماً)
                    (PUNC &amp;quot;)
                    (PP
                    (PREP ل)
                    (NP
                    (NP
                    (DET+NOUN+CASE_DEF_GEN لضغوط)
                    (DET+ADJ+NSUFF_FEM_SG+CASE_DEF_GEN الداخلية)
                    (PP
                    (PREP ل)
                    (NP
                    (DET+NOUN+CASE_DEF_GEN لرأي)
                    (DET+ADJ+CASE_DEF_GEN العام)
                    (DET+ADJ+CASE_DEF_GEN الاسرائيلي)
                    (PUNC ,)
                    (NAC
                    (CONJ و)
                    (S-ADV
                    (VP
                    (PSEUDO_VERB لكن)
                    (NP-SBJ-1
                    (PRON_3MS ه)
                    (S
                    (VP
                    (PRT
                    (FUT_PART س)
                    (IV3MS+IV+IVSUFF_MOOD:I يشرح)
                    (NP-SBJ
                    (-NONE- *-1)
                    (PP
                    (PREP ل)
                    (NP
                    (NOUN_PROP شارون)
                    (NP-OBJ
                    (NOUN+NSUFF_FEM_SG+CASE_DEF_ACC اهمية)
                    (NP
                    (NP
                    (NOUN+CASE_DEF_GEN ضبط)
                    (NP
                    (DET+NOUN+CASE_DEF_GEN النفس)
                    (ADJP
                    (DET+ADJ+CASE_DEF_GEN الاسرائيلي)
                    (PUNC &amp;quot;)
                    (PUNC .)
                </parse>
                <arg f="" g="" n="0">-NONE- *-1&amp;lt;بوش</arg>
                <arg f="" g="to Sharon" n="2">لشارون</arg>
                <arg f="" g="the importance for Israel of self-control" n="1">أهمية ضبط النفس الإسرائيلي</arg>
            </example>
        </frame>
    </frameset>
</verb>
