<!DOCTYPE verb SYSTEM "verb.dtd">
<verb>
<id>muHiyT</id>
<comment/>
<frameset cdef="" edef="surrounding" id="01">
<role argnum="0" argrole="surrounding entity"/>
<frame>
<mapping>
<comment/>
</mapping>
<example>
<parse>(S
    (CONJ و)
    (VP
      (PV+PVSUFF_SUBJ:3FS حضت)
      (NP-SBJ
        (-NONE- *))
      (NP-OBJ
        (DET+NOUN+NSUFF_MASC_PL_ACC الاميركيين))
      (PP-MNR
        (PREP ب)
        (NP
          (NOUN+NSUFF_FEM_SG+CASE_INDEF_GEN قوة)))
      (PP-CLR
        (PREP على)
        (NP
          (NOUN+CASE_DEF_GEN تجنب)
          (NP
            (NP
              (DET+NOUN+CASE_DEF_GEN السفر))
            (PP-DIR
              (PREP الى)
              (NP
                (NP
                  (NOUN_PROP ايوديا))
                (CONJ و)
                (NP
                  (NP
                    (NP
                      (DET+NOUN+CASE_DEF_GEN المناطق))
                    (SBAR
                      (WHNP-1
                        (-NONE- 0))
                      (S
                        (VP
                          (DET+ADJ.VN+NSUFF_FEM_SG+CASE_DEF_GEN المحيطة)
                          (NP-SBJ
                            (-NONE- *T*-1))
                          (PP-CLR
                            (PREP ب)
                            (NP
                              (PRON_3FS ها)))))))
                  (PP-LOC
                    (PREP في)
                    (NP
                      (NOUN+NSUFF_FEM_SG+CASE_DEF_GEN ولاية)
                      (NP
                        (NOUN_PROP اوتار)
                        (NOUN_PROP براديش)))))))))))
    (PUNC .)))</parse>
<comment/>
<arg f="" g="they" n="0">-NONE- *T*-1&gt; المناطق</arg>
<arg f="" g="by them" n="1">بها</arg>
</example>
<comment/>
</frame>
<comment/>
<role argnum="1" argrole="what? (marked by ب)"/>
</frameset>
</verb>