<!DOCTYPE verb SYSTEM "verb.dtd">
<verb>
    <id>Ou$oEil</id>
    <frameset cdef="" edef="light, to set on fire or make lighter" id="01">
        <role argnum="0" argrole="setter"/>
        <role argnum="1" argrole="entity"/>
        <frame>
            <example>
                <parse>
                    (S
                    (S
                    (VP
                    (PV+PVSUFF_SUBJ:3FS انطفأت)
                    (NP-SBJ
                    (DET+NOUN+CASE_DEF_NOM الاضواء))))
                    (CONJ ف)
                    (S
                    (VP
                    (PV_PASS+PVSUFF_SUBJ:3FS أشعلت)
                    (NP-SBJ-2
                    (DET+NOUN+CASE_DEF_NOM الشموع))
                    (NP-OBJ
                    (-NONE- *-2))))
                    (PUNC ,)
                    (CONJ و)
                    (S
                    (NP-TPC-1
                    (NOUN+CASE_INDEF_NOM دموع))
                    (VP
                    (PV+PVSUFF_SUBJ:3FS استمرت)
                    (NP-SBJ
                    (-NONE- *T*-1))
                    (NP-ADV
                    (NOUN+CASE_DEF_ACC نحو)
                    (NP
                    (NOUN_NUM 25)
                    (NP
                    (NOUN+CASE_INDEF_ACC عاماً))))
                    (PUNC -LRB-)
                    (PUNC .)
                    (PUNC .)
                    (PUNC .)
                    (PUNC -RRB-)))
                    (PUNC .))
                </parse>
                <arg f="" g="the candles" n="1">الشموع</arg>
            </example>
        </frame>
    </frameset>
</verb>
