<!DOCTYPE verb SYSTEM "verb.dtd">
<verb>
    <id>OaqoraD</id>
    <comment/>
    <frameset cdef="" edef="to lend" id="01">
        <role argnum="0" argrole="lender"/>
        <frame>
            <mapping>
                <comment/>
            </mapping>
            <example>
                <parse>بنك تونس العربي الدولي أقرض عائلة بن علي 350 مليون دينار</parse>
                <comment/>
                <arg f="" g="it" n="0">* &gt;  بنك تونس العربي الدولي</arg>
                <arg f="" g="family of Ben Ali" n="1">عائلة بن علي</arg>
                <arg f="" g="350 million dinars" n="2">350 مليون دينار</arg>
            </example>
            <comment/>
        </frame>
        <comment/>
        <role argnum="1" argrole="lent-to"/>
        <role argnum="2" argrole="thing lent"/>
    </frameset>
</verb>
