<!DOCTYPE verb SYSTEM "verb.dtd">
<verb>
    <id>$ahid-a</id>
    <frameset cdef="" edef="to witness, experience" id="01">
        <role argnum="0" argrole="the experiencer"/>
        <role argnum="1" argrole="thing experienced"/>
        <frame>
            <example>
                <parse>
                    (S
                    (CONJ و)
                    (VP
                    (PRT
                    (VERB_PART قد))
                    (PV+PVSUFF_SUBJ:1P شهدنا)
                    (NP-SBJ
                    (-NONE- *))
                    (NP-TMP
                    (NOUN+CASE_DEF_ACC خلال)
                    (NP
                    (DET+NOUN+NSUFF_FEM_DU_GEN السنتين)
                    (DET+ADJ+NSUFF_FEM_DU_GEN الماضيتين)))
                    (NP-OBJ
                    (NP
                    (NOUN+CASE_INDEF_ACC التزاماً)
                    (ADJ+CASE_INDEF_ACC سياسياً)
                    (ADJ+CASE_INDEF_ACC متزايداً))
                    (PP
                    (PREP ب)
                    (NP
                    (DET+NOUN+NSUFF_FEM_SG+CASE_DEF_GEN الصحة))))
                    (PP-LOC
                    (PREP في)
                    (NP
                    (NOUN_QUANT+CASE_DEF_GEN كل)
                    (NP
                    (NOUN+CASE_DEF_GEN انحاء)
                    (NP
                    (DET+NOUN+CASE_DEF_GEN العالم))))))
                    (PUNC .))
                </parse>
                <arg f="" g="we" n="0">*</arg>
                <arg f="tmp" g="during the past 2 years" n="m">خلال السنتين الماضيتين</arg>
                <arg f="" g="an increased interest in health" n="1">التزاماً سياسياً متزايداً بالصحة</arg>
                <arg f="loc" g="all over the world" n="m">في كل انحاء العالم</arg>
            </example>
            <example>
                <parse>
                    (S
                    (CONJ فَ-)
                    (SBAR-ADV
                    (SUB_CONJ -إِذا)
                    (S
                    (VP
                    (PV+PVSUFF_SUBJ:3FS نَجَحَت)
                    (NP-SBJ
                    (-NONE- *))
                    (PP-CLR
                    (PREP فِي)
                    (NP
                    (NOUN+CASE_DEF_GEN إِعْدادِ)
                    (NP
                    (DET+NOUN+CASE_DEF_GEN الأُسْتاذِ)
                    (DET+ADJ+CASE_DEF_GEN الكَفِيِّ))))
                    (PP
                    (PREP عَلَى)
                    (NP
                    (NP
                    (NOUN+CASE_DEF_GEN كُلِّ)
                    (DET+NOUN+NSUFF_FEM_PL+CASE_DEF_GEN المُسْتَوَياتِ)
                    (DET+ADJ+NSUFF_FEM_SG+CASE_DEF_GEN التَّعْلِيمِيَّةِ)))))))
                    (VP
                    (FUT+IV1P+IV+IVSUFF_MOOD:I سَنَشْهَدُ)
                    (NP-SBJ
                    (-NONE- *))
                    (NP-OBJ
                    (NOUN+NSUFF_FEM_SG+CASE_INDEF_ACC نَهْضَةً))
                    (PP
                    (PREP فِي)
                    (NP
                    (DET+NOUN+CASE_DEF_GEN التَّعْلِيمِ)
                    (DET+ADJ+CASE_DEF_GEN الرَّسْمِيِّ))))
                    (PUNC &amp;quot;)
                    (PUNC .))
                </parse>
                <arg f="" g="we" n="0">*</arg>
                <arg f="" g="a renewal" n="1">نَهْضَةً</arg>
                <arg f="" g="in official education" n="2">فِي التَّعْلِيمِ الرَّسْمِيِّ</arg>
            </example>
        </frame>
    </frameset>
    <frameset cdef="" edef="to confirm or certify" id="02">
        <role argnum="0" argrole="agent, confirmer"/>
        <role argnum="1" argrole="theme, entity certified"/>
        <role argnum="2" argrole="secondary predicate"/>
        <frame>
            <example>
                <parse>
                    ARG1 marked by على
                    
                    يشهد معرض صور لخروتشوف على زعامته المضطربة
                </parse>
                <arg f="" g="a photo gallery of Khrushchev" n="0">معرض صور لخروتشوف</arg>
                <arg f="" g="his troubled leadership" n="1">على زعامته المضطربة</arg>
            </example>
            <example>
                <parse>
                    ARG1 marked by ب
                    
                    كل من يشهد **-1 بـلا اله الا الله مسلم
                </parse>
                <arg f="" g="-NONE- &amp;lt; who" n="0">**-1 &amp;lt; من</arg>
                <arg f="" g="there is no God but Allah" n="1">بـلا اله الا الله</arg>
            </example>
            <example>
                <parse>
                    ARG1 is SBAR
                    شائعات كثيرة أخري هدفها إثارة المسلمين وإثارة الأقباط‏ والواقع يشهد **-1 أن المسلمين والأقباط يعيشون معا في اندماج‏
                </parse>
                <arg f="" g="-NONE- &amp;lt; reality" n="0">**-1 &amp;lt; الواقع</arg>
                <arg f="" g="that the Muslims and the Copts live mixed in together" n="1">أن المسلمين والأقباط يعيشون معا في اندماج‏</arg>
            </example>
        </frame>
    </frameset>
</verb>
